Question Number,Question,Option A,Option B,Option C,Option D,Answer
1,What is the capital of France?,Paris,London,Berlin,Madrid,Paris
2,Define Newton's First Law of Motion.,An object in motion stays in motion unless acted upon by an external force.,Force is equal to mass times acceleration.,Every action has an equal and opposite reaction.,Energy cannot be created or destroyed.,An object in motion stays in motion unless acted upon by an external force.
3,Who wrote 'To Kill a Mockingbird'?,Harper Lee,J.K. Rowling,Ernest Hemingway,Mark Twain,Harper Lee
4,What is the chemical symbol for Gold?,Au,Ag,Pb,Fe,Au
5,Explain the process of photosynthesis.,Plants use sunlight to convert carbon dioxide and water into glucose and oxygen.,Plants absorb nitrogen from the air for growth.,Photosynthesis occurs only in animals.,Plants release carbon dioxide during photosynthesis.,Plants use sunlight to convert carbon dioxide and water into glucose and oxygen.
